<?xml version="1.0" encoding="UTF-8"?>
<!DOCTYPE sqlinfos SYSTEM "../../dtd/sql-info.dtd">

<sqlinfos>
	<sqlinfo sqlid="JY5001U001">
		<sqlname>新增物资使用信息</sqlname>
		<sql><![CDATA[
			INSERT INTO jy_material_use (
			    jy_material_id,
				use_user,
				use_date,
				use_number,
				status,
				remark,
				inputuser,
				crt_date,
				crt_time
			)
			VALUES
			(
				$N{jy_material_id},
				$N{sys_user_id},
				$S{use_date},
				$N{use_number},
				1,
				$S{remark},
				$N{sys_user_id},
				$S{SYSDATE},
				$S{SYSTIME}
			);
		]]></sql>
	</sqlinfo>
	


	<sqlinfo sqlid="JY5001Q001">
		<sqlname>查询当前用户物资使用信息</sqlname>
		<sql><![CDATA[
		SELECT
			t1.id,
			t1.jy_material_id,
			m1.`code` material_code,
			m1.`name` material_name,
			m1.model,
			m1.supplier,
			t1.use_user,
			u1.`name` user_name,
			t1.use_date,
			t1.use_number,
			t1.remark,
			t1.`status`
		FROM
			jy_material_use t1
		LEFT JOIN jy_user u1 ON t1.use_user = u1.id
		LEFT JOIN jy_material m1 ON t1.jy_material_id = m1.id
		WHERE
			(
				t1.use_user = $N{sys_user_id}
			)
			AND
			(
                $ISNULL{id}
                OR t1.id = $N{id}
            ) 
			AND
			(
                $ISNULL{jy_material_id}
                OR t1.jy_material_id = $N{jy_material_id}
            ) 
            AND
			(
                $ISNULL{status}
                OR t1.status = $N{status}
            ) 
            AND
			(
               $ISNULL{date_start}
               or 
               t1.use_date >= $S{date_start}
            )
             AND
            (
                $ISNULL{date_end}
                or
                t1.use_date <= $S{date_end}
            )
             
		]]></sql>
	</sqlinfo>


	<sqlinfo sqlid="JY5001Q002">
		<sqlname>查询当前用户物资使用信息</sqlname>
		<sql><![CDATA[
		SELECT
			t1.id,
			t1.jy_material_id,
			m1.`code` material_code,
			m1.`name` material_name,
			m1.model,
			m1.supplier,
			t1.use_user,
			u1.`name` user_name,
			t1.use_date,
			t1.use_number,
			t1.remark,
			t1.`status`
		FROM
			jy_material_use t1
		LEFT JOIN jy_user u1 ON t1.use_user = u1.id
		LEFT JOIN jy_material m1 ON t1.jy_material_id = m1.id
		WHERE
			
			(
                $ISNULL{id}
                OR t1.id = $N{id}
            ) 
			AND
			(
                $ISNULL{jy_material_id}
                OR t1.jy_material_id = $N{jy_material_id}
            ) 
            AND
			(
                $ISNULL{status}
                OR t1.status = $N{status}
            ) 
            AND
			(
               $ISNULL{date_start}
               or 
               t1.use_date >= $S{date_start}
            )
             AND
            (
                $ISNULL{date_end}
                or
                t1.use_date <= $S{date_end}
            )
            AND
            (
				$ISNULL{use_user_name}
                OR u1.`name` like '%$U{use_user_name}%'
			)
			
             
		]]></sql>
	</sqlinfo>

	<sqlinfo sqlid="JY5001Q003">
		<sqlname>查询当前用户物资持有信息（申请物资数量）</sqlname>
		<sql><![CDATA[
			SELECT
				t1.jy_material_id,
				sum(t1.apply_number) apply_number,
				t2.`code` material_code,
				t2.`name` material_name,
				t2.model,
				t2.supplier,
				t3.`code` material_type_code,
				t3.`name` material_type_name
			FROM
				jy_apply t0
			LEFT JOIN jy_apply_detail t1 ON t0.id = t1.jy_apply_id
			LEFT JOIN jy_material t2 ON t1.jy_material_id = t2.id
			LEFT JOIN jy_material_type t3 ON t2.jy_material_type_id = t3.id
			WHERE
				t0.`status` = 4
				and
				(
	                t0.apply_user = $N{sys_user_id}
	            ) 
	             AND
				(
	                $ISNULL{jy_material_id}
	                OR t1.jy_material_id = $N{jy_material_id}
	            ) 
	     			
			GROUP BY
				t1.jy_material_id
			
        ]]></sql>
	</sqlinfo>
	
	
</sqlinfos>