<?xml version="1.0" encoding="UTF-8"?>
<!DOCTYPE sqlinfos SYSTEM "../../dtd/sql-info.dtd">

<sqlinfos>
	<sqlinfo sqlid="JY7001U001">
		<sqlname>新增物资仓储调拨信息</sqlname>
		<sql><![CDATA[
			INSERT INTO jy_transfer (
			    transfer_code,
			    transfer_date,
			    transfer_type,
				putin_user,
				putin_storehouse_code,
				putout_user,
				putout_storehouse_code,
				status,
				remark,
				inputuser,
				crt_date,
				crt_time
			)
			VALUES
			(
				$S{transfer_code},
				$S{transfer_date},
				$N{transfer_type},
				$N{putin_user},
				$S{putin_storehouse_code},
				$N{putout_user},
				$S{putout_storehouse_code},
				1,
				$S{remark},
				$N{sys_user_id},
				$S{SYSDATE},
				$S{SYSTIME}
			);
		]]></sql>
	</sqlinfo>
	


	<sqlinfo sqlid="JY7001U002">
		<sqlname>新增物资仓储调拨信息明细</sqlname>
		<sql><![CDATA[
			INSERT INTO jy_transfer_detail (
			jy_transfer_id,
			jy_material_id,
			transfer_number
		)
		VALUES
		(
			$N{jy_transfer_id},
			$N{jy_material_id},
			$N{transfer_number}
		);
		]]></sql>
	</sqlinfo>

				
   <sqlinfo sqlid="JY7001U003">
		<sqlname>修改物资仓储调拨信息明细</sqlname>
		<sql><![CDATA[
			UPDATE jy_transfer
			SET 
			transfer_date = $S{transfer_date}, 
			transfer_type = $N{transfer_type}, 
			putin_user = $N{putin_user}, 
			putin_storehouse_code = $S{putin_storehouse_code}, 
			putout_user = $N{putout_user}, 
			putout_storehouse_code = $S{putout_storehouse_code}, 
			remark = $S{remark},
			status = 1
			WHERE
				id = $N{id};
		]]></sql>
	</sqlinfo>


	<sqlinfo sqlid="JY7001U004">
			<sqlname>修改物资仓储调拨状态信息</sqlname>
			<sql><![CDATA[
			UPDATE jy_transfer
			SET 
			status = $N{status}
			WHERE
				id = $N{id};
			]]></sql>
	</sqlinfo>


    <sqlinfo sqlid="JY7001Q001">
		<sqlname>查询物资仓储调拨基本信息的id</sqlname>
		<sql><![CDATA[
		SELECT
				id
			FROM
				jy_transfer
			WHERE
				transfer_code =$S{transfer_code};
		]]></sql>
	</sqlinfo>
	
	
	<sqlinfo sqlid="JY7001Q002">
		<sqlname>查询物资仓储调拨基本信息</sqlname>
		<sql><![CDATA[
			SELECT
				t1.id,
				t1.transfer_code,
				t1.transfer_date,
				t1.transfer_type,
				t1.putin_user,
				u1.`name` putin_user_name,
				t1.putin_storehouse_code,
				p1.param_name putin_storehouse_name,
				t1.putout_user,
				u2.`name` putout_user_name,
				t1.putout_storehouse_code,
				p2.param_name putout_storehouse_name,
				t1.`status`,
				t1.remark,
				t1.inputuser,
				t1.crt_date,
				t1.crt_time
			FROM
				jy_transfer t1
			LEFT JOIN jy_user u1 ON t1.putin_user = u1.id
			LEFT JOIN jy_user u2 ON t1.putout_user = u2.id
			LEFT JOIN jy_params p1 ON t1.putin_storehouse_code = p1.param_code
			LEFT JOIN jy_params p2 ON t1.putout_storehouse_code = p2.param_code
			WHERE
			(
				t1.putin_user = $N{sys_user_id} or
				t1.putout_user = $N{sys_user_id} 
			)
			AND
			(
                $ISNULL{id}
                OR t1.id = $N{id}
            ) 
            AND
			(
                $ISNULL{transfer_type}
                OR t1.transfer_type = $N{transfer_type}
            )
			AND
			(
                $ISNULL{transfer_code}
                OR t1.transfer_code like '%$U{transfer_code}%'
            ) 
            AND
			(
                $ISNULL{date_start}
                OR t1.transfer_date >= $S{date_start}
            ) 
            AND
			(
                $ISNULL{date_end}
                OR t1.transfer_date <= $S{date_end}
            ) 
            AND
			(
                $ISNULL{putin_user}
                OR t1.putin_user = $S{putin_user}
            )
            AND
			(
                $ISNULL{putin_storehouse_code}
                OR t1.putin_storehouse_code = $S{putin_storehouse_code}
            ) 
             AND
			(
                $ISNULL{putout_user}
                OR t1.putout_user = $S{putout_user}
            )
            AND
			(
                $ISNULL{putout_storehouse_code}
                OR t1.putout_storehouse_code = $S{putout_storehouse_code}
            ) 
			
		]]></sql>
	</sqlinfo>
	
	
	<sqlinfo sqlid="JY7001Q003">
		<sqlname>查询物资仓储调拨明细信息通过主表id</sqlname>
		<sql><![CDATA[
			SELECT
				t1.jy_transfer_id,
				t1.jy_material_id,
				t1.transfer_number,
				t2.`code` material_code,
				t2.`name` material_name,
				t2.model,
				t2.supplier,
				t3.`code` material_type_code,
				t3.`name` material_type_name
			FROM
				jy_transfer_detail t1
			LEFT JOIN jy_material t2 ON t1.jy_material_id = t2.id
			LEFT JOIN jy_material_type t3 ON t2.jy_material_type_id = t3.id
			WHERE
				jy_transfer_id = $N{id};
		]]></sql>
	</sqlinfo>
	
	
	<sqlinfo sqlid="JY7001Q004">
		<sqlname>查询物资仓储调拨明细的状态</sqlname>
		<sql><![CDATA[
			SELECT
				t1.`status`
			FROM
				jy_transfer t1
			WHERE
				t1.id =$S{id};
		]]></sql>
	</sqlinfo>
	
	
	
	<sqlinfo sqlid="JY7001D001">
		<sqlname>删除物资仓储调拨主表</sqlname>
		<sql><![CDATA[
			DELETE FROM jy_transfer where id = $N{id}
		]]></sql>
	</sqlinfo>
	
	
	<sqlinfo sqlid="JY7001D002">
		<sqlname>删除物资仓储调拨明细</sqlname>
		<sql><![CDATA[
			DELETE FROM jy_transfer_detail where jy_transfer_id = $N{id}
		]]></sql>
	</sqlinfo>
	
	
	
	
	
	
</sqlinfos>